name,description
Зомби вирус,"Прогрессирующее во времени и пространстве распространение инфекционного заболевания среди людей способно стать источником чрезвычайной ситуации. Люди теперь зомби. Вокруг бункера малая часть зомби ходит по земле, которая неизбежно погибнет."
Вторжение Ктулху,"Распространение книг и настольных игр по вселенной Лавкрафта привело к появлению фанатиков которые сумели призвать в наш мир Ктулху. Человечество массово теряет рассудок. Укройтесь в бункере и сохраните свой разум. После выхода будьте готовы отбить атаки отродий, провести изгнание Ктулху и его приспешников из нашего мира и навсегда запечатать мистические врата между мирами."
Вторжение Дьявола,"Тёмные силы из потустороннего мира решили напасть на человечество. В итоге уничтожены почти все города, но люди смогли укрыться в специально оборудованных бункерах. Почва не пригодна для выращивания растений, нужна дополнительная обработка."
Биотерроризм,"При создании смертоносного штамма вируса в стенах исследовательской лабораторий, один из работников случайно  заразился им, в результате чего вирус вышел из-под контроля и очень быстро распространился по всей планете. Большая часть населения погибла. У остальных существ и растений развились мутации."
Химическая война,"В результате применения химического и бактериологического оружия был нарушен микробиологический состав почв, значительно изменился экологический баланс, растения, почва и вода были отравлены."
Милый дом,"В мир проникло нечто странное. У людей появился ряд симптомов: кровотечение из носа, потеря сознания, голоса в голове. Через некоторое время эти люди стали превращаться в различных монстров, причем каждый был уникальным и обладал своими способностями. Монстры были намного сильнее людей и убить их можно было лишь полностью уничтожив тело, из-за чего большая часть человечества погибла. Продержитесь в бункере до прихода армии и спасите свою жизнь."
Кровавый потоп,"Вампиры, долго жившие очень скрытно, наконец, вышли из тени. Их большая сила и бессмертие позволили им стремительно поглотить большую часть человечества. Скройтесь в бункере и дождитесь великого восхода Нового Солнца."
Метеорит,"Крупный метеорит приближается к Земле. Столкновение приведет к глобальным разрушениям, смене климата, гибели людей, флоры и фауны. После выхода из бункера вам продстоит найти место пригодное для проживания и обеспечить пропитание в суровых условиях вечной зимы."